<?xml version="1.0"?>
<!DOCTYPE plugin-package PUBLIC "-//Liferay//DTD Plugin Package 4.3.0//EN" "http://www.liferay.com/dtd/liferay-plugin-package_4_3_0.dtd">

<plugin-package>
	<name>Alfresco Client</name>
	<module-id>alfresco/client/4.3.0/war</module-id>
	<types>
		<type>portlet</type>
	</types>
	<short-description>
		Access the Alfresco UI as a portlet
	</short-description>
	<page-url>http://www.liferay.com/web/guest/downloads<page-url>
	<liferay-versions>
		<liferay-version>4.2.*</liferay-version>
	</liferay-versions>
</plugin-package>
