<?xml version="1.0"?>
<!DOCTYPE plugin-package PUBLIC "-//Liferay//DTD Plugin Package 4.3.0//EN" "http://www.liferay.com/dtd/liferay-plugin-package_4_3_0.dtd">

<plugin-package>
	<name>Sample Unstyled Theme</name>
	<module-id>liferay-samples/sample-unstyled-theme/4.3.0/war</module-id>
	<types>
		<type>theme</type>
	</types>
	<tags>
		<tag>sample</tag>
	</tags>
	<short-description>
		This is a sample unstyled theme with configuration set in
		liferay-look-and-feel.xml.
	</short-description>
	<change-log>
		Adapted to the latest version of Liferay.
	</change-log>
	<page-url>http://www.liferay.com/web/guest/downloads</page-url>
	<author>Liferay, Inc.</author>
	<licenses>
		<license osi-approved="true">MIT</license>
	</licenses>
	<liferay-versions>
		<liferay-version>4.3.*</liferay-version>
	</liferay-versions>
</plugin-package>