<?xml version="1.0"?>
<!DOCTYPE plugin-package PUBLIC "-//Liferay//DTD Plugin Package 4.3.0//EN" "http://www.liferay.com/dtd/liferay-plugin-package_4_3_0.dtd">

<plugin-package>
	<name>Sample Base WAP Theme</name>
	<module-id>liferay-samples/sample-base-wap-theme/4.2.1/war</module-id>
	<types>
		<type>theme</type>
	</types>
	<tags>
		<tag>sample</tag>
	</tags>
	<short-description>
		This is a base theme for WAP clients.
	</short-description>
	<change-log>
		Adapted to the latest version of Liferay.
	</change-log>
	<page-url>http://www.liferay.com/web/guest/downloads/samples</page-url>
	<author>Liferay, Inc.</author>
	<licenses>
		<license osi-approved="true">MIT</license>
	</licenses>
	<liferay-versions>
		<liferay-version>4.2.*</liferay-version>
	</liferay-versions>
</plugin-package>