<?xml version="1.0"?>
<!DOCTYPE plugin-package PUBLIC "-//Liferay//DTD Plugin Package 4.3.0//EN" "http://www.liferay.com/dtd/liferay-plugin-package_4_3_0.dtd">

<plugin-package>
	<name>Sample Spring Portlet</name>
	<module-id>liferay-samples/sample-spring-portlet/4.3.0/war</module-id>
	<types>
		<type>portlet</type>
	</types>
	<tags>
		<tag>sample</tag>
	</tags>
	<short-description>
		This portlet shows how to use Spring within Liferay.
	</short-description>
	<change-log>
		Adapted to the latest version of Liferay
	</change-log>
	<page-url>http://www.liferay.com/web/guest/downloads</page-url>
	<author>Interface21</author>
	<licenses>
		<license osi-approved="true">Apache</license>
	</licenses>
	<liferay-versions>
		<liferay-version>4.2.*</liferay-version>
	</liferay-versions>
</plugin-package>